Tcpdump is an open source command line tool that allows users to analyze network traffic. Below are few examples of Tcpdump command.

The below command list information of 10 packets from any interfaces with no filters.
┌──(kali㉿kali)-[~/Desktop]
└─$ sudo tcpdump -i any -c 10
tcpdump: WARNING: any: That device doesn't support promiscuous mode
(Promiscuous mode not supported on the "any" device)
tcpdump: verbose output suppressed, use -v[v]... for full protocol decode
listening on any, link-type LINUX_SLL2 (Linux cooked v2), snapshot length 262144 bytes
12:44:24.704445 eth0  Out IP 192.168.190.134.42062 > hkg12s32-in-f3.1e100.net.http: Flags [.], ack 1873283209, win 64240, length 0
12:44:24.705070 eth0  In  IP hkg12s32-in-f3.1e100.net.http > 192.168.190.134.42062: Flags [.], ack 1, win 64240, length 0
12:44:24.717763 eth0  Out IP 192.168.190.134.33308 > 192.168.190.2.domain: 46166+ PTR? 67.207.250.142.in-addr.arpa. (45)
12:44:24.723300 eth0  In  IP 192.168.190.2.domain > 192.168.190.134.33308: 46166 2/0/0 PTR hkg12s32-in-f3.1e100.net., PTR pnmaaa-bd-in-f3.1e100.net. (113)
12:44:24.723902 eth0  Out IP 192.168.190.134.38312 > 192.168.190.2.domain: 16732+ PTR? 134.190.168.192.in-addr.arpa. (46)
12:44:24.729625 eth0  In  IP 192.168.190.2.domain > 192.168.190.134.38312: 16732 NXDomain 0/1/0 (123)
12:44:24.820598 eth0  Out IP 192.168.190.134.54779 > 192.168.190.2.domain: 10474+ PTR? 2.190.168.192.in-addr.arpa. (44)
12:44:24.825319 eth0  In  IP 192.168.190.2.domain > 192.168.190.134.54779: 10474 NXDomain 0/1/0 (121)
12:44:27.008378 eth0  Out IP 192.168.190.134.41452 > 202.53.5.11.http: Flags [.], ack 306670052, win 62461, length 0
12:44:27.008705 eth0  In  IP 202.53.5.11.http > 192.168.190.134.41452: Flags [.], ack 1, win 64240, length 0
10 packets captured
12 packets received by filter
0 packets dropped by kernel
                      
The below command list information of 10 packets from any interfaces with a filter that only lists packets that utilize icmp protocol                                                                                                                                      
┌──(kali㉿kali)-[~/Desktop]
└─$ sudo tcpdump -i any -c 10 icmp
tcpdump: WARNING: any: That device doesn't support promiscuous mode
(Promiscuous mode not supported on the "any" device)
tcpdump: verbose output suppressed, use -v[v]... for full protocol decode
listening on any, link-type LINUX_SLL2 (Linux cooked v2), snapshot length 262144 bytes
^C
0 packets captured
0 packets received by filter
0 packets dropped by kernel
                 
The below command list information of 10 packets from any interfaces with a filter that only lists packets from port 80.                                                                                                                                           
┌──(kali㉿kali)-[~/Desktop]
└─$ sudo tcpdump -i any -c 10 port 80
tcpdump: WARNING: any: That device doesn't support promiscuous mode
(Promiscuous mode not supported on the "any" device)
tcpdump: verbose output suppressed, use -v[v]... for full protocol decode
listening on any, link-type LINUX_SLL2 (Linux cooked v2), snapshot length 262144 bytes
12:46:11.968324 eth0  Out IP 192.168.190.134.53082 > hkg12s32-in-f3.1e100.net.http: Flags [.], ack 184225018, win 63784, length 0
12:46:12.420391 eth0  Out IP 192.168.190.134.53074 > hkg12s32-in-f3.1e100.net.http: Flags [.], ack 868102659, win 60853, length 0
12:46:12.440266 eth0  Out IP 192.168.190.134.54818 > 104.18.38.233.http: Flags [.], ack 1217362052, win 62208, length 0
12:46:12.736344 eth0  Out IP 192.168.190.134.51362 > a23-58-31-18.deploy.static.akamaitechnologies.com.http: Flags [.], ack 947156011, win 63367, length 0
12:46:12.736907 eth0  In  IP a23-58-31-18.deploy.static.akamaitechnologies.com.http > 192.168.190.134.51362: Flags [.], ack 1, win 64240, length 0
12:46:12.992425 eth0  Out IP 192.168.190.134.53082 > hkg12s32-in-f3.1e100.net.http: Flags [.], ack 1, win 63784, length 0
12:46:12.993405 eth0  In  IP hkg12s32-in-f3.1e100.net.http > 192.168.190.134.53082: Flags [.], ack 1, win 64240, length 0
12:46:13.444248 eth0  Out IP 192.168.190.134.53074 > hkg12s32-in-f3.1e100.net.http: Flags [.], ack 1, win 60853, length 0
12:46:13.444637 eth0  In  IP hkg12s32-in-f3.1e100.net.http > 192.168.190.134.53074: Flags [.], ack 1, win 64240, length 0
12:46:13.472194 eth0  Out IP 192.168.190.134.54818 > 104.18.38.233.http: Flags [.], ack 1, win 62208, length 0
10 packets captured
11 packets received by filter
0 packets dropped by kernel


The below command list information of 10 packets from any interfaces with a filter that lists out packets from the source having a particular ip address.                                                                                                                                                            
┌──(kali㉿kali)-[~/Desktop]
└─$ sudo tcpdump -i any -c 10 src 192.168.190.134
tcpdump: WARNING: any: That device doesn't support promiscuous mode
(Promiscuous mode not supported on the "any" device)
tcpdump: verbose output suppressed, use -v[v]... for full protocol decode
listening on any, link-type LINUX_SLL2 (Linux cooked v2), snapshot length 262144 bytes
12:47:09.160389 eth0  Out IP 192.168.190.134.37724 > 209.100.149.34.bc.googleusercontent.com.https: Flags [P.], seq 2333098858:2333098904, ack 1834741648, win 52560, length 46
12:47:09.160484 eth0  Out IP 192.168.190.134.42630 > 151.101.129.91.https: Flags [P.], seq 911154750:911154796, ack 1771927686, win 65535, length 46
12:47:09.160801 eth0  Out IP 192.168.190.134.42630 > 151.101.129.91.https: Flags [P.], seq 46:77, ack 1, win 65535, length 31
12:47:09.160882 eth0  Out IP 192.168.190.134.42630 > 151.101.129.91.https: Flags [F.], seq 77, ack 1, win 65535, length 0
12:47:09.161732 eth0  Out IP 192.168.190.134.37724 > 209.100.149.34.bc.googleusercontent.com.https: Flags [P.], seq 46:77, ack 1, win 52560, length 31
12:47:09.161794 eth0  Out IP 192.168.190.134.37724 > 209.100.149.34.bc.googleusercontent.com.https: Flags [F.], seq 77, ack 1, win 52560, length 0
12:47:09.164974 eth0  Out IP 192.168.190.134.37724 > 209.100.149.34.bc.googleusercontent.com.https: Flags [.], ack 2, win 52560, length 0
12:47:09.184951 eth0  Out IP 192.168.190.134.42630 > 151.101.129.91.https: Flags [R], seq 911154828, win 0, length 0
12:47:09.240870 eth0  Out IP 192.168.190.134.37643 > 192.168.190.2.domain: 13791+ PTR? 209.100.149.34.in-addr.arpa. (45)
12:47:10.160715 eth0  Out IP 192.168.190.134.52996 > 44.51.49.34.bc.googleusercontent.com.https: Flags [P.], seq 3272474823:3272474862, ack 488594335, win 65535, length 39
10 packets captured
29 packets received by filter
0 packets dropped by kernel
